{
  "schema": "ev4-responsive-reference-family@1.0.0",
  "golden_reference_id": "golden-smart-home-tablet",
  "golden_reference_version": "1.0.0",
  "golden_reference_scope": "tablet",
  "golden_reference_family": "smart-home-connector-reference-family",
  "parent_reference_id": "golden-smart-home-desktop",
  "adaptation_type": "same_tree_adaptation",
  "per_viewport_reference_authorization": {
    "desktop": "authorized",
    "tablet": "authorized",
    "mobile": "not_authorized"
  },
  "reference_supersedes": null,
  "superseded_by": null,
  "raw_screenshot_authority": false,
  "desktop_screenshot_proves_mobile_or_tablet": false
}
